{
  "model": "gemini-3.8-flash-tts",
  "voices": {
    "Teacher": "Kore",
    "Student": "Puck"
  },
  "turns": [
    {
      "speaker": "Teacher",
      "text": "Have you ever been to Japan?",
      "style": "warm and natural"
    },
    {
      "speaker": "Student",
      "text": "Not yet, but I'd love to go someday.",
      "style": "young, relaxed, conversational"
    }
  ],
  "output_mime_type": "audio/wav"
}
